{
  "v": 1,
  "skill_id": "codex-blender-jewelry-clasp-modeling-v1",
  "title": "blender-jewelry-clasp-modeling",
  "status": "CANDIDATE",
  "summary": "Model or refine ornamental jewelry clasps, connecting rings, flat-band ferrules, heart or diamond frames, and gemstone settings in Blender from visual references. Use for silhouette hierarchy, full metal cross sections, actual interlocking connections and visually tensioned strap assemblies. Not a substitute for cloth simulation, structural engineering, character rigging or game-runtime acceptance.",
  "tags": [
    "codex-import",
    "blender-jewelry-clasp-modeling",
    "blender"
  ],
  "applicability": {
    "intents": [
      "Model or refine ornamental jewelry clasps, connecting rings, flat-band ferrules, heart or diamond frames, and gemstone settings in Blender from visual references. Use for silhouette hierarchy, full metal cross sections, actual interlocking connections and visually tensioned strap assemblies. Not a substitute for cloth simulation, structural engineering, character rigging or game-runtime acceptance."
    ],
    "required_capabilities": [
      "blender"
    ],
    "constraints": [
      "Imported from a local Codex user Skill; source semantics must be reviewed before promotion.",
      "Current task requirements and fresh evidence override imported instructions."
    ]
  },
  "procedure": [
    {
      "step_id": "imported-procedure",
      "instruction": "Read the sanitized imported Codex Skill snapshot and follow its reusable procedure while preserving its stated constraints. Refine this candidate into native CAH steps before promotion.",
      "deterministic": false,
      "implementation_refs": [
        "imports/codex-skills/sources/blender-jewelry-clasp-modeling/source.md"
      ]
    }
  ],
  "evidence": [],
  "stats": {
    "success_count": 0,
    "failure_count": 0,
    "use_count": 0
  },
  "provenance": {
    "created_at": "2026-10-25T00:00:00+09:00",
    "updated_at": "2026-10-25T00:00:00+09:00",
    "source_kind": "public_procedure",
    "source_refs": [
      "docs/SKILL_SYSTEM.md"
    ]
  }
}
