{
  "v": 1,
  "skill_id": "codex-nte-character-toggle-menu-v1",
  "title": "nte-character-toggle-menu",
  "status": "CANDIDATE",
  "summary": "Create or repair character-bound NTE outfit and accessory toggle menus. Mount on the owning character mesh/AnimBP rather than a world-global controller, save every selection immediately, reload saved choices after reconstruction, and reset only on the user's Reset click. Use for 人物挂载菜单、服装开关、避免干扰其他角色控件、点击自动保存. Not for intentionally global vehicle/tool dashboards.",
  "tags": [
    "codex-import",
    "nte-character-toggle-menu"
  ],
  "applicability": {
    "intents": [
      "Create or repair character-bound NTE outfit and accessory toggle menus. Mount on the owning character mesh/AnimBP rather than a world-global controller, save every selection immediately, reload saved choices after reconstruction, and reset only on the user's Reset click. Use for 人物挂载菜单、服装开关、避免干扰其他角色控件、点击自动保存. Not for intentionally global vehicle/tool dashboards."
    ],
    "required_capabilities": [],
    "constraints": [
      "Imported from a local Codex user Skill; source semantics must be reviewed before promotion.",
      "Current task requirements and fresh evidence override imported instructions."
    ]
  },
  "procedure": [
    {
      "step_id": "imported-procedure",
      "instruction": "Read the sanitized imported Codex Skill snapshot and follow its reusable procedure while preserving its stated constraints. Refine this candidate into native CAH steps before promotion.",
      "deterministic": false,
      "implementation_refs": [
        "imports/codex-skills/sources/nte-character-toggle-menu/source.md"
      ]
    }
  ],
  "evidence": [],
  "stats": {
    "success_count": 0,
    "failure_count": 0,
    "use_count": 0
  },
  "provenance": {
    "created_at": "2026-10-25T00:00:00+09:00",
    "updated_at": "2026-10-25T00:00:00+09:00",
    "source_kind": "public_procedure",
    "source_refs": [
      "docs/SKILL_SYSTEM.md"
    ]
  }
}
