{
  "v": 1,
  "skill_id": "codex-blender-leather-item-authoring-v1",
  "title": "blender-leather-item-authoring",
  "status": "CANDIDATE",
  "summary": "Create or refine detailed Blender leather items—backpacks, bags, pouches and similar stylized accessories—from design images or an existing native model. Use for clean shell and pocket construction, strap/handle cross sections, curved-surface artwork, zipper alignment, raised dashed stitching, and precise user-redline revisions. Not a substitute for character fitting, rigging, game cooking, or generating concept images.",
  "tags": [
    "codex-import",
    "blender-leather-item-authoring",
    "blender",
    "unreal",
    "python"
  ],
  "applicability": {
    "intents": [
      "Create or refine detailed Blender leather items—backpacks, bags, pouches and similar stylized accessories—from design images or an existing native model. Use for clean shell and pocket construction, strap/handle cross sections, curved-surface artwork, zipper alignment, raised dashed stitching, and precise user-redline revisions. Not a substitute for character fitting, rigging, game cooking, or generating concept images."
    ],
    "required_capabilities": [
      "blender",
      "unreal",
      "python"
    ],
    "constraints": [
      "Imported from a local Codex user Skill; source semantics must be reviewed before promotion.",
      "Current task requirements and fresh evidence override imported instructions."
    ]
  },
  "procedure": [
    {
      "step_id": "imported-procedure",
      "instruction": "Read the sanitized imported Codex Skill snapshot and follow its reusable procedure while preserving its stated constraints. Refine this candidate into native GAH steps before promotion.",
      "deterministic": false,
      "implementation_refs": [
        "imports/codex-skills/sources/blender-leather-item-authoring/source.md"
      ]
    }
  ],
  "evidence": [],
  "stats": {
    "success_count": 0,
    "failure_count": 0,
    "use_count": 0
  },
  "provenance": {
    "created_at": "2026-10-25T00:00:00+09:00",
    "updated_at": "2026-10-25T00:00:00+09:00",
    "source_kind": "public_procedure",
    "source_refs": [
      "docs/SKILL_SYSTEM.md"
    ]
  }
}
