{
  "v": 1,
  "skill_id": "codex-blender-clothing-pose-diagnostics-v1",
  "title": "blender-clothing-pose-diagnostics",
  "status": "CANDIDATE",
  "summary": "Diagnose and locally repair animation-driven clothing clipping in Blender using component-color isolation, evaluated skeletal deformation, multi-pose clearance indicators, skin-derived weight transfer, and matching separate seam weights. Use for clothing or crotch patches that fit at rest but open during running, leg lifts, or posing. This is controlled-pose skinning analysis, not cloth physics or a guarantee of collision-free game animation.",
  "tags": [
    "codex-import",
    "blender-clothing-pose-diagnostics",
    "blender",
    "python"
  ],
  "applicability": {
    "intents": [
      "Diagnose and locally repair animation-driven clothing clipping in Blender using component-color isolation, evaluated skeletal deformation, multi-pose clearance indicators, skin-derived weight transfer, and matching separate seam weights. Use for clothing or crotch patches that fit at rest but open during running, leg lifts, or posing. This is controlled-pose skinning analysis, not cloth physics or a guarantee of collision-free game animation."
    ],
    "required_capabilities": [
      "blender",
      "python"
    ],
    "constraints": [
      "Imported from a local Codex user Skill; source semantics must be reviewed before promotion.",
      "Current task requirements and fresh evidence override imported instructions."
    ]
  },
  "procedure": [
    {
      "step_id": "imported-procedure",
      "instruction": "Read the sanitized imported Codex Skill snapshot and follow its reusable procedure while preserving its stated constraints. Refine this candidate into native CAH steps before promotion.",
      "deterministic": false,
      "implementation_refs": [
        "imports/codex-skills/sources/blender-clothing-pose-diagnostics/source.md"
      ]
    }
  ],
  "evidence": [],
  "stats": {
    "success_count": 0,
    "failure_count": 0,
    "use_count": 0
  },
  "provenance": {
    "created_at": "2026-10-25T00:00:00+09:00",
    "updated_at": "2026-10-25T00:00:00+09:00",
    "source_kind": "public_procedure",
    "source_refs": [
      "docs/SKILL_SYSTEM.md"
    ]
  }
}
