{
  "v": 1,
  "skill_id": "codex-nte-mod-authoring-v1",
  "title": "nte-mod-authoring",
  "status": "CANDIDATE",
  "summary": "Create, adapt, cook, package, verify, and troubleshoot Neverness to Everness (NTE/异环) project-authored cosmetic mods using the standalone FModel → Blender → Unreal Engine 5.6 → NTE_Outfit_System/KawaiiPhysics workflow. Use for basic mesh or texture replacements, modular outfit items, custom hair/tails/ears with secondary motion, per-character detachable parts, UE cooking, and .pak/.ucas/.utoc packaging. Do not use this skill for raw IoStore package transplants or binary asset-graph migration.",
  "tags": [
    "codex-import",
    "nte-mod-authoring",
    "blender",
    "unreal"
  ],
  "applicability": {
    "intents": [
      "Create, adapt, cook, package, verify, and troubleshoot Neverness to Everness (NTE/异环) project-authored cosmetic mods using the standalone FModel → Blender → Unreal Engine 5.6 → NTE_Outfit_System/KawaiiPhysics workflow. Use for basic mesh or texture replacements, modular outfit items, custom hair/tails/ears with secondary motion, per-character detachable parts, UE cooking, and .pak/.ucas/.utoc packaging. Do not use this skill for raw IoStore package transplants or binary asset-graph migration."
    ],
    "required_capabilities": [
      "blender",
      "unreal"
    ],
    "constraints": [
      "Imported from a local Codex user Skill; source semantics must be reviewed before promotion.",
      "Current task requirements and fresh evidence override imported instructions."
    ]
  },
  "procedure": [
    {
      "step_id": "imported-procedure",
      "instruction": "Read the sanitized imported Codex Skill snapshot and follow its reusable procedure while preserving its stated constraints. Refine this candidate into native GAH steps before promotion.",
      "deterministic": false,
      "implementation_refs": [
        "imports/codex-skills/sources/nte-mod-authoring/source.md"
      ]
    }
  ],
  "evidence": [],
  "stats": {
    "success_count": 0,
    "failure_count": 0,
    "use_count": 0
  },
  "provenance": {
    "created_at": "2026-10-25T00:00:00+09:00",
    "updated_at": "2026-10-25T00:00:00+09:00",
    "source_kind": "public_procedure",
    "source_refs": [
      "docs/SKILL_SYSTEM.md"
    ]
  }
}
